CPF,Nome,Cargo,Lotação
"***.557.233-**","ADNILSON DE SOUSA OLIVEIRA","AGENTE DE COMBATE A ENDEMIAS","EFETIVOS"
"***.476.561-**","ALDENICE EVANGELISTA LIMA","AGENTE COMUNITÁRIO DE SAÚDE","EFETIVOS"
"***.643.713-**","ANA CRISTINA DE SOUSA FRANCO MORAIS","AUXILIAR DE SAÚDE BUCAL","EFETIVOS"
"***.585.273-**","ANA KADYJA CARDOSO DANTAS","ODONTOLOGO","EFETIVOS"
"***.706.883-**","ANDREIA ALCANTARA LIMA","TÉCNICO DE ENFERMAGEM","EFETIVOS"
"***.986.303-**","DANIELA VELOSO PAIVA","AGENTE COMUNITÁRIO DE SAÚDE","EFETIVOS"
"***.124.623-**","EDILEUZA TEIXEIRA DA SILVA","AUXILIAR DE SAÚDE BUCAL","EFETIVOS"
"***.293.733-**","EDINALVA HELENA DE SOUSA","AGENTE COMUNITÁRIO DE SAÚDE","EFETIVOS"
"***.274.773-**","ELISSANDRA DE JESUS LOPES","TÉCNICO DE ENFERMAGEM","EFETIVOS"